{
  "kind": "repi-memory-contract",
  "schemaVersion": 1,
  "events": [
    {
      "kind": "repi-memory-event",
      "schemaVersion": 1,
      "id": "mem:a75082dd8c9b88bf3089",
      "seq": 1,
      "ts": "2026-06-10T12:00:00.000Z",
      "source": "reflect",
      "task": "browser authz state machine replay",
      "route": "web-api",
      "target": "https://target.local",
      "domainTags": [
        "web-api",
        "authz",
        "reflection"
      ],
      "caseSignature": "7a5a804a93496afa66644ec8",
      "outcome": "success",
      "lessons": [
        "Authz state-machine replay produced stable route and principal matrix before final claim."
      ],
      "failurePatterns": [
        "Narrative-only authz conclusions without request/response artifact must be demoted."
      ],
      "reuseRules": [
        "Run re_web_authz_state run <url> before compiler final when route ownership is uncertain."
      ],
      "commands": [
        "re_web_authz_state run https://target.local 30000",
        "re_verifier matrix https://target.local"
      ],
      "artifacts": [
        {
          "path": "/tmp/repi/evidence/web-authz/artifact.md",
          "sha256": "8a50274b1c010509dcbb84077f52d49aeeb83adcff52881cd93f8c627cb2ca5c",
          "tier": "runtime_artifact",
          "required": true
        }
      ],
      "artifactHashes": [
        {
          "path": "/tmp/repi/evidence/web-authz/artifact.md",
          "sha256": "8a50274b1c010509dcbb84077f52d49aeeb83adcff52881cd93f8c627cb2ca5c",
          "tier": "runtime_artifact",
          "required": true
        }
      ],
      "quality": {
        "confidence": 0.91,
        "replayVerified": true,
        "reuseCount": 1,
        "failureCount": 0,
        "lastUsefulAt": "2026-06-10T12:00:00.000Z",
        "decay": 0
      },
      "promotion": {
        "playbookCandidate": true,
        "workerRoutingHint": "worker:web-authz -> authz-state-machine",
        "verifierRuleCandidate": true
      },
      "prevHash": "0000000000000000000000000000000000000000000000000000000000000000",
      "entryHash": "c222645fafcd4add663dc39bc02feeced3fafd45e72ee50bfdc69d8e4731fb2a"
    }
  ],
  "caseMemory": [
    {
      "kind": "repi-case-memory",
      "schemaVersion": 1,
      "id": "case:7a5a804a93496afa66644ec8:1",
      "ts": "2026-06-10T12:00:00.000Z",
      "caseSignature": "7a5a804a93496afa66644ec8",
      "route": "web-api",
      "target": "https://target.local",
      "domainTags": [
        "web-api",
        "authz",
        "reflection"
      ],
      "summary": "Authz state-machine replay is reusable when ownership is uncertain.",
      "eventIds": [
        "mem:a75082dd8c9b88bf3089"
      ],
      "commands": [
        "re_web_authz_state run https://target.local 30000",
        "re_verifier matrix https://target.local"
      ],
      "reuseRules": [
        "Run re_web_authz_state run <url> before compiler final when route ownership is uncertain."
      ],
      "failurePatterns": [
        "Narrative-only authz conclusions without request/response artifact must be demoted."
      ],
      "quality": {
        "confidence": 0.91,
        "replayVerified": true,
        "reuseCount": 1,
        "failureCount": 0,
        "lastUsefulAt": "2026-06-10T12:00:00.000Z",
        "decay": 0
      },
      "sourceEvents": [
        "c222645fafcd4add663dc39bc02feeced3fafd45e72ee50bfdc69d8e4731fb2a"
      ],
      "lastEventHash": "c222645fafcd4add663dc39bc02feeced3fafd45e72ee50bfdc69d8e4731fb2a"
    }
  ],
  "retrievalReport": {
    "kind": "repi-memory-retrieval-report",
    "schemaVersion": 1,
    "query": "authz replay",
    "hashChainOk": true,
    "hits": [
      {
        "id": "mem:a75082dd8c9b88bf3089",
        "score": 28.5,
        "reasons": [
          "token:authz",
          "token:replay"
        ],
        "caseSignature": "7a5a804a93496afa66644ec8",
        "outcome": "success",
        "quality": {
          "confidence": 0.91,
          "replayVerified": true,
          "reuseCount": 1,
          "failureCount": 0,
          "lastUsefulAt": "2026-06-10T12:00:00.000Z",
          "decay": 0
        },
        "commands": [
          "re_web_authz_state run https://target.local 30000",
          "re_verifier matrix https://target.local"
        ]
      }
    ]
  }
}
